{
    "schemaVersion":  "1.0.0",
    "scriptVersion":  "0.2.0",
    "modelVersion":  "1.0.0",
    "policyLibraryVersion":  "1.0.0",
    "generatedAt":  "2026-09-21T12:00:00.0000000Z",
    "tenant":  {
                   "fingerprint":  "aaaaaaaaaaaaaaaaaaaaaaaaaaaaaaaaaaaaaaaaaaaaaaaaaaaaaaaaaaaaaaaa",
                   "cloud":  "Global"
               },
    "collector":  {
                      "powerShellVersion":  "7.5.0",
                      "graphSdkVersion":  "2.0.0",
                      "apiVersion":  "v1.0"
                  },
    "context":  {
                    "policyCount":  0,
                    "enabledPolicyCount":  0,
                    "reportOnlyPolicyCount":  0,
                    "licensing":  {
                                      "hasEntraP1":  false,
                                      "hasEntraP2":  false
                                  },
                    "signInActivity":  {
                                           "requested":  false,
                                           "legacyAuthSignInsLast7Days":  null
                                       }
                },
    "assessment":  {
                       "stage":  0,
                       "provisionalStage":  0,
                       "confidence":  0.04,
                       "confidenceLabel":  "low",
                       "stageResults":  {
                                            "1":  {
                                                      "stage":  1,
                                                      "requiredCount":  6,
                                                      "applicableCount":  6,
                                                      "detectedCount":  1,
                                                      "coveragePercent":  17,
                                                      "confirmed":  false,
                                                      "provisional":  false,
                                                      "missing":  [

                                                                  ],
                                                      "unresolved":  [
                                                                         "block-legacy-auth",
                                                                         "mfa-admins-strict",
                                                                         "break-glass-exclusion",
                                                                         "mfa-registration-enforcement",
                                                                         "block-unsupported-platforms"
                                                                     ],
                                                      "failedCritical":  [
                                                                             "block-legacy-auth",
                                                                             "mfa-admins-strict",
                                                                             "break-glass-exclusion"
                                                                         ]
                                                  },
                                            "2":  {
                                                      "stage":  2,
                                                      "requiredCount":  6,
                                                      "applicableCount":  6,
                                                      "detectedCount":  0,
                                                      "coveragePercent":  0,
                                                      "confirmed":  false,
                                                      "provisional":  false,
                                                      "missing":  [

                                                                  ],
                                                      "unresolved":  [
                                                                         "device-compliance-sensitive-apps",
                                                                         "session-controls-unmanaged",
                                                                         "guest-access-restriction",
                                                                         "app-protection-policy-mam",
                                                                         "azure-management-protection",
                                                                         "terms-of-use"
                                                                     ],
                                                      "failedCritical":  [
                                                                             "device-compliance-sensitive-apps",
                                                                             "guest-access-restriction"
                                                                         ]
                                                  },
                                            "3":  {
                                                      "stage":  3,
                                                      "requiredCount":  7,
                                                      "applicableCount":  7,
                                                      "detectedCount":  0,
                                                      "coveragePercent":  0,
                                                      "confirmed":  false,
                                                      "provisional":  false,
                                                      "missing":  [

                                                                  ],
                                                      "unresolved":  [
                                                                         "risk-based-signin",
                                                                         "risk-based-user",
                                                                         "auth-strength-phishing-resistant",
                                                                         "pim-step-up",
                                                                         "cae-enable",
                                                                         "workload-identity-ca",
                                                                         "token-protection"
                                                                     ],
                                                      "failedCritical":  [
                                                                             "risk-based-signin",
                                                                             "risk-based-user",
                                                                             "auth-strength-phishing-resistant"
                                                                         ]
                                                  },
                                            "4":  {
                                                      "stage":  4,
                                                      "requiredCount":  5,
                                                      "applicableCount":  5,
                                                      "detectedCount":  0,
                                                      "coveragePercent":  0,
                                                      "confirmed":  false,
                                                      "provisional":  false,
                                                      "missing":  [

                                                                  ],
                                                      "unresolved":  [
                                                                         "cross-tenant-access-enforcement",
                                                                         "global-secure-access",
                                                                         "defender-cloud-apps-session-control",
                                                                         "insider-risk-signal",
                                                                         "policy-as-code"
                                                                     ],
                                                      "failedCritical":  [
                                                                             "cross-tenant-access-enforcement",
                                                                             "policy-as-code"
                                                                         ]
                                                  }
                                        }
                   },
    "signals":  {
                    "block-legacy-auth":  {
                                              "status":  "unknown",
                                              "reason":  "Fixture \u0027mostly-unknown\u0027 sets block-legacy-auth to unknown.",
                                              "evidence":  [

                                                           ],
                                              "checkedAt":  "2026-09-22T11:43:26.6963580Z"
                                          },
                    "mfa-all-users":  {
                                          "status":  "detected",
                                          "reason":  "Fixture \u0027mostly-unknown\u0027 sets mfa-all-users to detected.",
                                          "evidence":  [

                                                       ],
                                          "checkedAt":  "2026-09-22T11:43:26.6963580Z"
                                      },